{"checks":[{"id":"check-asset-0","kind":"file.sha256","purpose":"Verify skills/ecc-guide/SKILL.md","sha256":"b6e30828406e562ef65d323f1366629239313f076a7a53ba7e8dbaec0e96b203","target":{"root":"project","segments":[{"literal":".claude"},{"literal":"skills"},{"literal":"ecc-guide"},{"literal":"SKILL.md"}]}},{"id":"check-asset-1","kind":"file.sha256","purpose":"Verify LICENSE","sha256":"326146379f01bb137c0a5d3c54770c1aa31076705c8b88a7f6b26a460f6221b2","target":{"root":"project","segments":[{"literal":".aihq"},{"literal":"ecc"},{"literal":"source"},{"literal":"ecc.skill.ecc-guide"},{"literal":"LICENSE"}]}}],"description":"Catalog overlay: deliver pinned ECC skill material; execute no source code.","id":"ecc.skill.ecc-guide","inputs":{},"materials":[{"byteLength":5611,"id":"asset-0","sha256":"b6e30828406e562ef65d323f1366629239313f076a7a53ba7e8dbaec0e96b203"},{"byteLength":1071,"id":"asset-1","sha256":"326146379f01bb137c0a5d3c54770c1aa31076705c8b88a7f6b26a460f6221b2"}],"operations":[{"checks":["check-asset-0"],"id":"write-asset-0","kind":"file.write","material":"asset-0","purpose":"Deliver skills/ecc-guide/SKILL.md","requires":[],"scope":"project","target":{"root":"project","segments":[{"literal":".claude"},{"literal":"skills"},{"literal":"ecc-guide"},{"literal":"SKILL.md"}]}},{"checks":["check-asset-1"],"id":"write-asset-1","kind":"file.write","material":"asset-1","purpose":"Deliver LICENSE","requires":[],"scope":"project","target":{"root":"project","segments":[{"literal":".aihq"},{"literal":"ecc"},{"literal":"source"},{"literal":"ecc.skill.ecc-guide"},{"literal":"LICENSE"}]}}],"prerequisites":[],"schema":"urn:aihq:core:recipe:1.0.0","targets":["project"]}
