{"checks":[{"id":"check-asset-0","kind":"file.sha256","purpose":"Verify skills/network-bgp-diagnostics/SKILL.md","sha256":"44a8d9ba4644f33cb86227e54641930a280fc4417ebce5c1744985b9f4913d03","target":{"root":"project","segments":[{"literal":".claude"},{"literal":"skills"},{"literal":"network-bgp-diagnostics"},{"literal":"SKILL.md"}]}},{"id":"check-asset-1","kind":"file.sha256","purpose":"Verify LICENSE","sha256":"326146379f01bb137c0a5d3c54770c1aa31076705c8b88a7f6b26a460f6221b2","target":{"root":"project","segments":[{"literal":".aihq"},{"literal":"ecc"},{"literal":"source"},{"literal":"ecc.skill.network-bgp-diagnostics"},{"literal":"LICENSE"}]}}],"description":"Catalog overlay: deliver pinned ECC skill material; execute no source code.","id":"ecc.skill.network-bgp-diagnostics","inputs":{},"materials":[{"byteLength":5641,"id":"asset-0","sha256":"44a8d9ba4644f33cb86227e54641930a280fc4417ebce5c1744985b9f4913d03"},{"byteLength":1071,"id":"asset-1","sha256":"326146379f01bb137c0a5d3c54770c1aa31076705c8b88a7f6b26a460f6221b2"}],"operations":[{"checks":["check-asset-0"],"id":"write-asset-0","kind":"file.write","material":"asset-0","purpose":"Deliver skills/network-bgp-diagnostics/SKILL.md","requires":[],"scope":"project","target":{"root":"project","segments":[{"literal":".claude"},{"literal":"skills"},{"literal":"network-bgp-diagnostics"},{"literal":"SKILL.md"}]}},{"checks":["check-asset-1"],"id":"write-asset-1","kind":"file.write","material":"asset-1","purpose":"Deliver LICENSE","requires":[],"scope":"project","target":{"root":"project","segments":[{"literal":".aihq"},{"literal":"ecc"},{"literal":"source"},{"literal":"ecc.skill.network-bgp-diagnostics"},{"literal":"LICENSE"}]}}],"prerequisites":[],"schema":"urn:aihq:core:recipe:1.0.0","targets":["project"]}
