{"checks":[{"id":"check-asset-0","kind":"file.sha256","purpose":"Verify rules/golang/security.md","sha256":"72ff9516083e017b718f76e7a6f6838611fa3c02b810b3572fef7d605b38d033","target":{"root":"project","segments":[{"literal":".claude"},{"literal":"rules"},{"literal":"golang"},{"literal":"security.md"}]}},{"id":"check-asset-1","kind":"file.sha256","purpose":"Verify LICENSE","sha256":"326146379f01bb137c0a5d3c54770c1aa31076705c8b88a7f6b26a460f6221b2","target":{"root":"project","segments":[{"literal":".aihq"},{"literal":"ecc"},{"literal":"source"},{"literal":"ecc.rule.golang.security"},{"literal":"LICENSE"}]}}],"description":"Catalog overlay: deliver pinned ECC instruction material; execute no source code.","id":"ecc.rule.golang.security","inputs":{},"materials":[{"byteLength":558,"id":"asset-0","sha256":"72ff9516083e017b718f76e7a6f6838611fa3c02b810b3572fef7d605b38d033"},{"byteLength":1071,"id":"asset-1","sha256":"326146379f01bb137c0a5d3c54770c1aa31076705c8b88a7f6b26a460f6221b2"}],"operations":[{"checks":["check-asset-0"],"id":"write-asset-0","kind":"file.write","material":"asset-0","purpose":"Deliver rules/golang/security.md","requires":[],"scope":"project","target":{"root":"project","segments":[{"literal":".claude"},{"literal":"rules"},{"literal":"golang"},{"literal":"security.md"}]}},{"checks":["check-asset-1"],"id":"write-asset-1","kind":"file.write","material":"asset-1","purpose":"Deliver LICENSE","requires":[],"scope":"project","target":{"root":"project","segments":[{"literal":".aihq"},{"literal":"ecc"},{"literal":"source"},{"literal":"ecc.rule.golang.security"},{"literal":"LICENSE"}]}}],"prerequisites":[],"schema":"urn:aihq:core:recipe:1.0.0","targets":["project"]}
