{"checks":[{"id":"check-license","kind":"file.sha256","purpose":"Verify LICENSE","sha256":"1d2d5be1cce51a92aead6ac9018d25480097edd5470dc06701154493f084527d","target":{"root":"project","segments":[{"literal":".claude"},{"literal":"skills"},{"literal":"documentation-and-adrs"},{"literal":"LICENSE"}]}},{"id":"check-asset-1","kind":"file.sha256","purpose":"Verify skills/documentation-and-adrs/SKILL.md","sha256":"874f620246a4bcad8805561f483d6fc0e494e9f6b375027aa7fd86989d5da5b3","target":{"root":"project","segments":[{"literal":".claude"},{"literal":"skills"},{"literal":"documentation-and-adrs"},{"literal":"SKILL.md"}]}},{"id":"check-asset-2","kind":"file.sha256","purpose":"Verify skills/documentation-and-adrs/agents/openai.yaml","sha256":"a1499d95abd8447558c535fe5554adcc3c9b988a0a39264a6283d430effe1e94","target":{"root":"project","segments":[{"literal":".claude"},{"literal":"skills"},{"literal":"documentation-and-adrs"},{"literal":"agents"},{"literal":"openai.yaml"}]}}],"description":"claude-code: documentation-and-adrs; exact pinned material delivery, native invocation remains unobserved.","id":"extensions.skill.documentation-and-adrs","inputs":{},"materials":[{"byteLength":7392,"id":"asset-1","sha256":"874f620246a4bcad8805561f483d6fc0e494e9f6b375027aa7fd86989d5da5b3"},{"byteLength":43,"id":"asset-2","sha256":"a1499d95abd8447558c535fe5554adcc3c9b988a0a39264a6283d430effe1e94"},{"byteLength":1078,"id":"license","sha256":"1d2d5be1cce51a92aead6ac9018d25480097edd5470dc06701154493f084527d"}],"operations":[{"checks":["check-license"],"id":"write-license","kind":"file.write","material":"license","purpose":"Deliver LICENSE","requires":[],"scope":"project","target":{"root":"project","segments":[{"literal":".claude"},{"literal":"skills"},{"literal":"documentation-and-adrs"},{"literal":"LICENSE"}]}},{"checks":["check-asset-1"],"id":"write-asset-1","kind":"file.write","material":"asset-1","purpose":"Deliver skills/documentation-and-adrs/SKILL.md","requires":[],"scope":"project","target":{"root":"project","segments":[{"literal":".claude"},{"literal":"skills"},{"literal":"documentation-and-adrs"},{"literal":"SKILL.md"}]}},{"checks":["check-asset-2"],"id":"write-asset-2","kind":"file.write","material":"asset-2","purpose":"Deliver skills/documentation-and-adrs/agents/openai.yaml","requires":[],"scope":"project","target":{"root":"project","segments":[{"literal":".claude"},{"literal":"skills"},{"literal":"documentation-and-adrs"},{"literal":"agents"},{"literal":"openai.yaml"}]}}],"prerequisites":[],"schema":"urn:aihq:core:recipe:1.0.0","targets":["project"]}
