{"checks":[{"id":"check-license","kind":"file.sha256","purpose":"Verify LICENSE","sha256":"1d2d5be1cce51a92aead6ac9018d25480097edd5470dc06701154493f084527d","target":{"root":"project","segments":[{"literal":".aih-extensions"},{"literal":"templates"},{"literal":"kiro-ide"},{"literal":"complete-LICENSE"}]}}],"description":"kiro-ide whole workflow convenience template; exact pinned material delivery, native invocation remains unobserved.","id":"extensions.kiro.template.complete","inputs":{},"materials":[{"byteLength":1078,"id":"license","sha256":"1d2d5be1cce51a92aead6ac9018d25480097edd5470dc06701154493f084527d"}],"operations":[{"checks":["check-license"],"id":"write-license","kind":"file.write","material":"license","purpose":"Deliver LICENSE","requires":[],"scope":"project","target":{"root":"project","segments":[{"literal":".aih-extensions"},{"literal":"templates"},{"literal":"kiro-ide"},{"literal":"complete-LICENSE"}]}}],"prerequisites":[],"schema":"urn:aihq:core:recipe:1.0.0","targets":["project"]}
