{"checks":[{"id":"check-asset-0","kind":"file.sha256","purpose":"Verify skills/motion-patterns/SKILL.md","sha256":"9d78bcd2c3b52abdb6fb29162f289b9c709547de264ad064b12e00bedb031907","target":{"root":"project","segments":[{"literal":".claude"},{"literal":"skills"},{"literal":"motion-patterns"},{"literal":"SKILL.md"}]}},{"id":"check-asset-1","kind":"file.sha256","purpose":"Verify LICENSE","sha256":"326146379f01bb137c0a5d3c54770c1aa31076705c8b88a7f6b26a460f6221b2","target":{"root":"project","segments":[{"literal":".aihq"},{"literal":"ecc"},{"literal":"source"},{"literal":"ecc.skill.motion-patterns"},{"literal":"LICENSE"}]}}],"description":"Catalog overlay: deliver pinned ECC skill material; execute no source code.","id":"ecc.skill.motion-patterns","inputs":{},"materials":[{"byteLength":13418,"id":"asset-0","sha256":"9d78bcd2c3b52abdb6fb29162f289b9c709547de264ad064b12e00bedb031907"},{"byteLength":1071,"id":"asset-1","sha256":"326146379f01bb137c0a5d3c54770c1aa31076705c8b88a7f6b26a460f6221b2"}],"operations":[{"checks":["check-asset-0"],"id":"write-asset-0","kind":"file.write","material":"asset-0","purpose":"Deliver skills/motion-patterns/SKILL.md","requires":[],"scope":"project","target":{"root":"project","segments":[{"literal":".claude"},{"literal":"skills"},{"literal":"motion-patterns"},{"literal":"SKILL.md"}]}},{"checks":["check-asset-1"],"id":"write-asset-1","kind":"file.write","material":"asset-1","purpose":"Deliver LICENSE","requires":[],"scope":"project","target":{"root":"project","segments":[{"literal":".aihq"},{"literal":"ecc"},{"literal":"source"},{"literal":"ecc.skill.motion-patterns"},{"literal":"LICENSE"}]}}],"prerequisites":[],"schema":"urn:aihq:core:recipe:1.0.0","targets":["project"]}
