{"checks":[{"id":"check-asset-0","kind":"file.sha256","purpose":"Verify .kiro/skills/django-patterns/SKILL.md","sha256":"267eb89f537a6626937d60fc732675f685b11209fa9025599c80e0f322e9a503","target":{"root":"project","segments":[{"literal":".kiro"},{"literal":"skills"},{"literal":"django-patterns"},{"literal":"SKILL.md"}]}},{"id":"check-asset-1","kind":"file.sha256","purpose":"Verify LICENSE","sha256":"326146379f01bb137c0a5d3c54770c1aa31076705c8b88a7f6b26a460f6221b2","target":{"root":"project","segments":[{"literal":".aihq"},{"literal":"ecc"},{"literal":"source"},{"literal":"ecc.kiro.skill.django-patterns"},{"literal":"LICENSE"}]}}],"description":"Catalog overlay: deliver pinned ECC skill material; execute no source code.","id":"ecc.kiro.skill.django-patterns","inputs":{},"materials":[{"byteLength":21025,"id":"asset-0","sha256":"267eb89f537a6626937d60fc732675f685b11209fa9025599c80e0f322e9a503"},{"byteLength":1071,"id":"asset-1","sha256":"326146379f01bb137c0a5d3c54770c1aa31076705c8b88a7f6b26a460f6221b2"}],"operations":[{"checks":["check-asset-0"],"id":"write-asset-0","kind":"file.write","material":"asset-0","purpose":"Deliver .kiro/skills/django-patterns/SKILL.md","requires":[],"scope":"project","target":{"root":"project","segments":[{"literal":".kiro"},{"literal":"skills"},{"literal":"django-patterns"},{"literal":"SKILL.md"}]}},{"checks":["check-asset-1"],"id":"write-asset-1","kind":"file.write","material":"asset-1","purpose":"Deliver LICENSE","requires":[],"scope":"project","target":{"root":"project","segments":[{"literal":".aihq"},{"literal":"ecc"},{"literal":"source"},{"literal":"ecc.kiro.skill.django-patterns"},{"literal":"LICENSE"}]}}],"prerequisites":[],"schema":"urn:aihq:core:recipe:1.0.0","targets":["project"]}
