{"checks":[{"id":"check-asset-0","kind":"file.sha256","purpose":"Verify .kiro/skills/postgres-patterns/SKILL.md","sha256":"d8735f5874431395c309c354f253d36e09a167f8a3318417a13e5760f68443ee","target":{"root":"project","segments":[{"literal":".kiro"},{"literal":"skills"},{"literal":"postgres-patterns"},{"literal":"SKILL.md"}]}},{"id":"check-asset-1","kind":"file.sha256","purpose":"Verify LICENSE","sha256":"326146379f01bb137c0a5d3c54770c1aa31076705c8b88a7f6b26a460f6221b2","target":{"root":"project","segments":[{"literal":".aihq"},{"literal":"ecc"},{"literal":"source"},{"literal":"ecc.kiro.skill.postgres-patterns"},{"literal":"LICENSE"}]}}],"description":"Catalog overlay: deliver pinned ECC skill material; execute no source code.","id":"ecc.kiro.skill.postgres-patterns","inputs":{},"materials":[{"byteLength":4168,"id":"asset-0","sha256":"d8735f5874431395c309c354f253d36e09a167f8a3318417a13e5760f68443ee"},{"byteLength":1071,"id":"asset-1","sha256":"326146379f01bb137c0a5d3c54770c1aa31076705c8b88a7f6b26a460f6221b2"}],"operations":[{"checks":["check-asset-0"],"id":"write-asset-0","kind":"file.write","material":"asset-0","purpose":"Deliver .kiro/skills/postgres-patterns/SKILL.md","requires":[],"scope":"project","target":{"root":"project","segments":[{"literal":".kiro"},{"literal":"skills"},{"literal":"postgres-patterns"},{"literal":"SKILL.md"}]}},{"checks":["check-asset-1"],"id":"write-asset-1","kind":"file.write","material":"asset-1","purpose":"Deliver LICENSE","requires":[],"scope":"project","target":{"root":"project","segments":[{"literal":".aihq"},{"literal":"ecc"},{"literal":"source"},{"literal":"ecc.kiro.skill.postgres-patterns"},{"literal":"LICENSE"}]}}],"prerequisites":[],"schema":"urn:aihq:core:recipe:1.0.0","targets":["project"]}
