{"checks":[{"id":"check-license","kind":"file.sha256","purpose":"Verify LICENSE","sha256":"0e7ac423bf2c6e223b7c5b156f8cf72da49d748e56a1641402c31f22ad07dbb5","target":{"root":"project","segments":[{"literal":".claude"},{"literal":"skills"},{"literal":"wayfinder"},{"literal":"LICENSE"}]}},{"id":"check-asset-1","kind":"file.sha256","purpose":"Verify skills/engineering/wayfinder/SKILL.md","sha256":"9be7b478c389605a24517d27752f278933588da97a1b5921b165f455edf4c5b7","target":{"root":"project","segments":[{"literal":".claude"},{"literal":"skills"},{"literal":"wayfinder"},{"literal":"SKILL.md"}]}},{"id":"check-asset-2","kind":"file.sha256","purpose":"Verify skills/engineering/wayfinder/agents/openai.yaml","sha256":"88bc81a11a6d52ac67aeaa76b8b619e387020d47c5133a4dd4927fd15c4ad073","target":{"root":"project","segments":[{"literal":".claude"},{"literal":"skills"},{"literal":"wayfinder"},{"literal":"agents"},{"literal":"openai.yaml"}]}}],"description":"claude-code: wayfinder; exact pinned material delivery, native invocation remains unobserved.","id":"extensions.matt.wayfinder","inputs":{},"materials":[{"byteLength":12380,"id":"asset-1","sha256":"9be7b478c389605a24517d27752f278933588da97a1b5921b165f455edf4c5b7"},{"byteLength":144,"id":"asset-2","sha256":"88bc81a11a6d52ac67aeaa76b8b619e387020d47c5133a4dd4927fd15c4ad073"},{"byteLength":1068,"id":"license","sha256":"0e7ac423bf2c6e223b7c5b156f8cf72da49d748e56a1641402c31f22ad07dbb5"}],"operations":[{"checks":["check-license"],"id":"write-license","kind":"file.write","material":"license","purpose":"Deliver LICENSE","requires":[],"scope":"project","target":{"root":"project","segments":[{"literal":".claude"},{"literal":"skills"},{"literal":"wayfinder"},{"literal":"LICENSE"}]}},{"checks":["check-asset-1"],"id":"write-asset-1","kind":"file.write","material":"asset-1","purpose":"Deliver skills/engineering/wayfinder/SKILL.md","requires":[],"scope":"project","target":{"root":"project","segments":[{"literal":".claude"},{"literal":"skills"},{"literal":"wayfinder"},{"literal":"SKILL.md"}]}},{"checks":["check-asset-2"],"id":"write-asset-2","kind":"file.write","material":"asset-2","purpose":"Deliver skills/engineering/wayfinder/agents/openai.yaml","requires":[],"scope":"project","target":{"root":"project","segments":[{"literal":".claude"},{"literal":"skills"},{"literal":"wayfinder"},{"literal":"agents"},{"literal":"openai.yaml"}]}}],"prerequisites":[],"schema":"urn:aihq:core:recipe:1.0.0","targets":["project"]}
