{"checks":[{"id":"check-asset-0","kind":"file.sha256","purpose":"Verify rules/react-native/testing.md","sha256":"989d2103a46e512dc7c20a7452c8c23b0301b55b0998fb92733f21721dba9382","target":{"root":"project","segments":[{"literal":".claude"},{"literal":"rules"},{"literal":"react-native"},{"literal":"testing.md"}]}},{"id":"check-asset-1","kind":"file.sha256","purpose":"Verify LICENSE","sha256":"326146379f01bb137c0a5d3c54770c1aa31076705c8b88a7f6b26a460f6221b2","target":{"root":"project","segments":[{"literal":".aihq"},{"literal":"ecc"},{"literal":"source"},{"literal":"ecc.rule.react-native.testing"},{"literal":"LICENSE"}]}}],"description":"Catalog overlay: deliver pinned ECC instruction material; execute no source code.","id":"ecc.rule.react-native.testing","inputs":{},"materials":[{"byteLength":1718,"id":"asset-0","sha256":"989d2103a46e512dc7c20a7452c8c23b0301b55b0998fb92733f21721dba9382"},{"byteLength":1071,"id":"asset-1","sha256":"326146379f01bb137c0a5d3c54770c1aa31076705c8b88a7f6b26a460f6221b2"}],"operations":[{"checks":["check-asset-0"],"id":"write-asset-0","kind":"file.write","material":"asset-0","purpose":"Deliver rules/react-native/testing.md","requires":[],"scope":"project","target":{"root":"project","segments":[{"literal":".claude"},{"literal":"rules"},{"literal":"react-native"},{"literal":"testing.md"}]}},{"checks":["check-asset-1"],"id":"write-asset-1","kind":"file.write","material":"asset-1","purpose":"Deliver LICENSE","requires":[],"scope":"project","target":{"root":"project","segments":[{"literal":".aihq"},{"literal":"ecc"},{"literal":"source"},{"literal":"ecc.rule.react-native.testing"},{"literal":"LICENSE"}]}}],"prerequisites":[],"schema":"urn:aihq:core:recipe:1.0.0","targets":["project"]}
