{"checks":[{"id":"check-asset-0","kind":"file.sha256","purpose":"Verify .kiro/skills/autonomous-loops/SKILL.md","sha256":"25431f497ec2b2b449ad280070e5f27566c06c2f39d9e1538996f92deee3d2f4","target":{"root":"project","segments":[{"literal":".kiro"},{"literal":"skills"},{"literal":"autonomous-loops"},{"literal":"SKILL.md"}]}},{"id":"check-asset-1","kind":"file.sha256","purpose":"Verify LICENSE","sha256":"326146379f01bb137c0a5d3c54770c1aa31076705c8b88a7f6b26a460f6221b2","target":{"root":"project","segments":[{"literal":".aihq"},{"literal":"ecc"},{"literal":"source"},{"literal":"ecc.kiro.skill.autonomous-loops"},{"literal":"LICENSE"}]}}],"description":"Catalog overlay: deliver pinned ECC skill material; execute no source code.","id":"ecc.kiro.skill.autonomous-loops","inputs":{},"materials":[{"byteLength":24726,"id":"asset-0","sha256":"25431f497ec2b2b449ad280070e5f27566c06c2f39d9e1538996f92deee3d2f4"},{"byteLength":1071,"id":"asset-1","sha256":"326146379f01bb137c0a5d3c54770c1aa31076705c8b88a7f6b26a460f6221b2"}],"operations":[{"checks":["check-asset-0"],"id":"write-asset-0","kind":"file.write","material":"asset-0","purpose":"Deliver .kiro/skills/autonomous-loops/SKILL.md","requires":[],"scope":"project","target":{"root":"project","segments":[{"literal":".kiro"},{"literal":"skills"},{"literal":"autonomous-loops"},{"literal":"SKILL.md"}]}},{"checks":["check-asset-1"],"id":"write-asset-1","kind":"file.write","material":"asset-1","purpose":"Deliver LICENSE","requires":[],"scope":"project","target":{"root":"project","segments":[{"literal":".aihq"},{"literal":"ecc"},{"literal":"source"},{"literal":"ecc.kiro.skill.autonomous-loops"},{"literal":"LICENSE"}]}}],"prerequisites":[],"schema":"urn:aihq:core:recipe:1.0.0","targets":["project"]}
