{"checks":[{"id":"check-asset-0","kind":"file.sha256","purpose":"Verify commands/plan-canvas.md","sha256":"8afc9d0bf73f79088ada2109310e988c7e961c0fb049b2b35ecc4b3706d253f9","target":{"root":"project","segments":[{"literal":".claude"},{"literal":"commands"},{"literal":"plan-canvas.md"}]}},{"id":"check-asset-1","kind":"file.sha256","purpose":"Verify LICENSE","sha256":"326146379f01bb137c0a5d3c54770c1aa31076705c8b88a7f6b26a460f6221b2","target":{"root":"project","segments":[{"literal":".aihq"},{"literal":"ecc"},{"literal":"source"},{"literal":"ecc.command.plan-canvas"},{"literal":"LICENSE"}]}}],"description":"Catalog overlay: deliver pinned ECC command material; execute no source code.","id":"ecc.command.plan-canvas","inputs":{},"materials":[{"byteLength":1699,"id":"asset-0","sha256":"8afc9d0bf73f79088ada2109310e988c7e961c0fb049b2b35ecc4b3706d253f9"},{"byteLength":1071,"id":"asset-1","sha256":"326146379f01bb137c0a5d3c54770c1aa31076705c8b88a7f6b26a460f6221b2"}],"operations":[{"checks":["check-asset-0"],"id":"write-asset-0","kind":"file.write","material":"asset-0","purpose":"Deliver commands/plan-canvas.md","requires":[],"scope":"project","target":{"root":"project","segments":[{"literal":".claude"},{"literal":"commands"},{"literal":"plan-canvas.md"}]}},{"checks":["check-asset-1"],"id":"write-asset-1","kind":"file.write","material":"asset-1","purpose":"Deliver LICENSE","requires":[],"scope":"project","target":{"root":"project","segments":[{"literal":".aihq"},{"literal":"ecc"},{"literal":"source"},{"literal":"ecc.command.plan-canvas"},{"literal":"LICENSE"}]}}],"prerequisites":[],"schema":"urn:aihq:core:recipe:1.0.0","targets":["project"]}
