{"checks":[{"id":"check-asset-0","kind":"file.sha256","purpose":"Verify .kiro/skills/pytorch-patterns/SKILL.md","sha256":"22b76f559f17d4b0e44eda71d353065e5da181203d165546edb08c16cc362d85","target":{"root":"project","segments":[{"literal":".kiro"},{"literal":"skills"},{"literal":"pytorch-patterns"},{"literal":"SKILL.md"}]}},{"id":"check-asset-1","kind":"file.sha256","purpose":"Verify LICENSE","sha256":"326146379f01bb137c0a5d3c54770c1aa31076705c8b88a7f6b26a460f6221b2","target":{"root":"project","segments":[{"literal":".aihq"},{"literal":"ecc"},{"literal":"source"},{"literal":"ecc.kiro.skill.pytorch-patterns"},{"literal":"LICENSE"}]}}],"description":"Catalog overlay: deliver pinned ECC skill material; execute no source code.","id":"ecc.kiro.skill.pytorch-patterns","inputs":{},"materials":[{"byteLength":11659,"id":"asset-0","sha256":"22b76f559f17d4b0e44eda71d353065e5da181203d165546edb08c16cc362d85"},{"byteLength":1071,"id":"asset-1","sha256":"326146379f01bb137c0a5d3c54770c1aa31076705c8b88a7f6b26a460f6221b2"}],"operations":[{"checks":["check-asset-0"],"id":"write-asset-0","kind":"file.write","material":"asset-0","purpose":"Deliver .kiro/skills/pytorch-patterns/SKILL.md","requires":[],"scope":"project","target":{"root":"project","segments":[{"literal":".kiro"},{"literal":"skills"},{"literal":"pytorch-patterns"},{"literal":"SKILL.md"}]}},{"checks":["check-asset-1"],"id":"write-asset-1","kind":"file.write","material":"asset-1","purpose":"Deliver LICENSE","requires":[],"scope":"project","target":{"root":"project","segments":[{"literal":".aihq"},{"literal":"ecc"},{"literal":"source"},{"literal":"ecc.kiro.skill.pytorch-patterns"},{"literal":"LICENSE"}]}}],"prerequisites":[],"schema":"urn:aihq:core:recipe:1.0.0","targets":["project"]}
