{"checks":[{"id":"check-asset-0","kind":"file.sha256","purpose":"Verify skills/swift-actor-persistence/SKILL.md","sha256":"438f75a3f37db2b8db699fb5d27a7207d0f31eace31d057b775ad152d6462c5c","target":{"root":"project","segments":[{"literal":".claude"},{"literal":"skills"},{"literal":"swift-actor-persistence"},{"literal":"SKILL.md"}]}},{"id":"check-asset-1","kind":"file.sha256","purpose":"Verify LICENSE","sha256":"326146379f01bb137c0a5d3c54770c1aa31076705c8b88a7f6b26a460f6221b2","target":{"root":"project","segments":[{"literal":".aihq"},{"literal":"ecc"},{"literal":"source"},{"literal":"ecc.skill.swift-actor-persistence"},{"literal":"LICENSE"}]}}],"description":"Catalog overlay: deliver pinned ECC skill material; execute no source code.","id":"ecc.skill.swift-actor-persistence","inputs":{},"materials":[{"byteLength":4906,"id":"asset-0","sha256":"438f75a3f37db2b8db699fb5d27a7207d0f31eace31d057b775ad152d6462c5c"},{"byteLength":1071,"id":"asset-1","sha256":"326146379f01bb137c0a5d3c54770c1aa31076705c8b88a7f6b26a460f6221b2"}],"operations":[{"checks":["check-asset-0"],"id":"write-asset-0","kind":"file.write","material":"asset-0","purpose":"Deliver skills/swift-actor-persistence/SKILL.md","requires":[],"scope":"project","target":{"root":"project","segments":[{"literal":".claude"},{"literal":"skills"},{"literal":"swift-actor-persistence"},{"literal":"SKILL.md"}]}},{"checks":["check-asset-1"],"id":"write-asset-1","kind":"file.write","material":"asset-1","purpose":"Deliver LICENSE","requires":[],"scope":"project","target":{"root":"project","segments":[{"literal":".aihq"},{"literal":"ecc"},{"literal":"source"},{"literal":"ecc.skill.swift-actor-persistence"},{"literal":"LICENSE"}]}}],"prerequisites":[],"schema":"urn:aihq:core:recipe:1.0.0","targets":["project"]}
