{"checks":[{"id":"check-license","kind":"file.sha256","purpose":"Verify LICENSE","sha256":"0e7ac423bf2c6e223b7c5b156f8cf72da49d748e56a1641402c31f22ad07dbb5","target":{"root":"project","segments":[{"literal":".github"},{"literal":"skills"},{"literal":"to-questionnaire"},{"literal":"LICENSE"}]}},{"id":"check-asset-1","kind":"file.sha256","purpose":"Verify skills/productivity/to-questionnaire/SKILL.md","sha256":"b5eb929842ee0e93d867c5e906d183d350f2f2d149eaeaa86967d94d8eda1d3b","target":{"root":"project","segments":[{"literal":".github"},{"literal":"skills"},{"literal":"to-questionnaire"},{"literal":"SKILL.md"}]}},{"id":"check-asset-2","kind":"file.sha256","purpose":"Verify skills/productivity/to-questionnaire/agents/openai.yaml","sha256":"9e8a06c38c8842eea8d4922cb9d1ead8e3ace647bab259b943c994a1b4742bc2","target":{"root":"project","segments":[{"literal":".github"},{"literal":"skills"},{"literal":"to-questionnaire"},{"literal":"agents"},{"literal":"openai.yaml"}]}}],"description":"copilot-vscode: to-questionnaire; exact pinned material delivery, native invocation remains unobserved.","id":"extensions.copilot.matt.to-questionnaire","inputs":{},"materials":[{"byteLength":2904,"id":"asset-1","sha256":"b5eb929842ee0e93d867c5e906d183d350f2f2d149eaeaa86967d94d8eda1d3b"},{"byteLength":166,"id":"asset-2","sha256":"9e8a06c38c8842eea8d4922cb9d1ead8e3ace647bab259b943c994a1b4742bc2"},{"byteLength":1068,"id":"license","sha256":"0e7ac423bf2c6e223b7c5b156f8cf72da49d748e56a1641402c31f22ad07dbb5"}],"operations":[{"checks":["check-license"],"id":"write-license","kind":"file.write","material":"license","purpose":"Deliver LICENSE","requires":[],"scope":"project","target":{"root":"project","segments":[{"literal":".github"},{"literal":"skills"},{"literal":"to-questionnaire"},{"literal":"LICENSE"}]}},{"checks":["check-asset-1"],"id":"write-asset-1","kind":"file.write","material":"asset-1","purpose":"Deliver skills/productivity/to-questionnaire/SKILL.md","requires":[],"scope":"project","target":{"root":"project","segments":[{"literal":".github"},{"literal":"skills"},{"literal":"to-questionnaire"},{"literal":"SKILL.md"}]}},{"checks":["check-asset-2"],"id":"write-asset-2","kind":"file.write","material":"asset-2","purpose":"Deliver skills/productivity/to-questionnaire/agents/openai.yaml","requires":[],"scope":"project","target":{"root":"project","segments":[{"literal":".github"},{"literal":"skills"},{"literal":"to-questionnaire"},{"literal":"agents"},{"literal":"openai.yaml"}]}}],"prerequisites":[],"schema":"urn:aihq:core:recipe:1.0.0","targets":["project"]}
