{"checks":[{"id":"check-asset-0","kind":"file.sha256","purpose":"Verify rules/angular/coding-style.md","sha256":"07ff77e554dad197c179c0fbd6b70dcbedbe4e038e95e60da0475134a5be856c","target":{"root":"project","segments":[{"literal":".claude"},{"literal":"rules"},{"literal":"angular"},{"literal":"coding-style.md"}]}},{"id":"check-asset-1","kind":"file.sha256","purpose":"Verify LICENSE","sha256":"326146379f01bb137c0a5d3c54770c1aa31076705c8b88a7f6b26a460f6221b2","target":{"root":"project","segments":[{"literal":".aihq"},{"literal":"ecc"},{"literal":"source"},{"literal":"ecc.rule.angular.coding-style"},{"literal":"LICENSE"}]}}],"description":"Catalog overlay: deliver pinned ECC instruction material; execute no source code.","id":"ecc.rule.angular.coding-style","inputs":{},"materials":[{"byteLength":5212,"id":"asset-0","sha256":"07ff77e554dad197c179c0fbd6b70dcbedbe4e038e95e60da0475134a5be856c"},{"byteLength":1071,"id":"asset-1","sha256":"326146379f01bb137c0a5d3c54770c1aa31076705c8b88a7f6b26a460f6221b2"}],"operations":[{"checks":["check-asset-0"],"id":"write-asset-0","kind":"file.write","material":"asset-0","purpose":"Deliver rules/angular/coding-style.md","requires":[],"scope":"project","target":{"root":"project","segments":[{"literal":".claude"},{"literal":"rules"},{"literal":"angular"},{"literal":"coding-style.md"}]}},{"checks":["check-asset-1"],"id":"write-asset-1","kind":"file.write","material":"asset-1","purpose":"Deliver LICENSE","requires":[],"scope":"project","target":{"root":"project","segments":[{"literal":".aihq"},{"literal":"ecc"},{"literal":"source"},{"literal":"ecc.rule.angular.coding-style"},{"literal":"LICENSE"}]}}],"prerequisites":[],"schema":"urn:aihq:core:recipe:1.0.0","targets":["project"]}
