{"checks":[{"id":"check-asset-0","kind":"file.sha256","purpose":"Verify skills/customer-billing-ops/SKILL.md","sha256":"4214d79be7d1bcb62587cf6364e96ed3b70b875ec41871ac632e827ef96b370e","target":{"root":"project","segments":[{"literal":".claude"},{"literal":"skills"},{"literal":"customer-billing-ops"},{"literal":"SKILL.md"}]}},{"id":"check-asset-1","kind":"file.sha256","purpose":"Verify LICENSE","sha256":"326146379f01bb137c0a5d3c54770c1aa31076705c8b88a7f6b26a460f6221b2","target":{"root":"project","segments":[{"literal":".aihq"},{"literal":"ecc"},{"literal":"source"},{"literal":"ecc.skill.customer-billing-ops"},{"literal":"LICENSE"}]}}],"description":"Catalog overlay: deliver pinned ECC skill material; execute no source code.","id":"ecc.skill.customer-billing-ops","inputs":{},"materials":[{"byteLength":4289,"id":"asset-0","sha256":"4214d79be7d1bcb62587cf6364e96ed3b70b875ec41871ac632e827ef96b370e"},{"byteLength":1071,"id":"asset-1","sha256":"326146379f01bb137c0a5d3c54770c1aa31076705c8b88a7f6b26a460f6221b2"}],"operations":[{"checks":["check-asset-0"],"id":"write-asset-0","kind":"file.write","material":"asset-0","purpose":"Deliver skills/customer-billing-ops/SKILL.md","requires":[],"scope":"project","target":{"root":"project","segments":[{"literal":".claude"},{"literal":"skills"},{"literal":"customer-billing-ops"},{"literal":"SKILL.md"}]}},{"checks":["check-asset-1"],"id":"write-asset-1","kind":"file.write","material":"asset-1","purpose":"Deliver LICENSE","requires":[],"scope":"project","target":{"root":"project","segments":[{"literal":".aihq"},{"literal":"ecc"},{"literal":"source"},{"literal":"ecc.skill.customer-billing-ops"},{"literal":"LICENSE"}]}}],"prerequisites":[],"schema":"urn:aihq:core:recipe:1.0.0","targets":["project"]}
